titulo,link,data_publicacao
"Seu plano estratégico de marketing de 1 ANO em apenas 1 DIA, agora em Campo Grande",https://www.beefpoint.com.br/seu-plano-estrategico-de-marketing-de-1-ano-em-apenas-1-dia-agora-em-campo-grande/,"Thu, 13 Apr 2023 18:39:14 +0000"
Índice de preços de alimentos da FAO tem décima segunda queda mensal,https://www.beefpoint.com.br/indice-de-precos-de-alimentos-da-fao-tem-decima-segunda-queda-mensal/,"Thu, 13 Apr 2023 14:23:19 +0000"
CEPEA: Arroba do boi volta a ser negociada acima do valor da carne,https://www.beefpoint.com.br/cepea-arroba-do-boi-volta-a-ser-negociada-acima-do-valor-da-carne/,"Thu, 13 Apr 2023 14:08:21 +0000"
"Produção de grãos está estimada em 312,5 milhões de toneladas na safra 2022/23",https://www.beefpoint.com.br/producao-de-graos-esta-estimada-em-3125-milhoes-de-toneladas-na-safra-2022-23/,"Thu, 13 Apr 2023 14:07:21 +0000"
Ponta alinha planos após concluir fusão￼,https://www.beefpoint.com.br/ponta-alinha-planos-apos-concluir-fusao%ef%bf%bc/,"Thu, 13 Apr 2023 14:05:47 +0000"
Commodities: Milho e trigo sobem em Chicago após impasse no Mar Negro,https://www.beefpoint.com.br/commodities-milho-e-trigo-sobem-em-chicago-apos-impasse-no-mar-negro/,"Thu, 13 Apr 2023 14:01:35 +0000"
Balizador de preços do boi gordo GPB/DATAGRO – Boletim de 12-abril-2023,https://www.beefpoint.com.br/balizador-de-precos-do-boi-gordo-gpb-datagro-boletim-de-12-abril-2023/,"Thu, 13 Apr 2023 14:00:11 +0000"
Brasil responderá por 25% das exportações globais de carne bovina em 2023,https://www.beefpoint.com.br/brasil-respondera-por-25-das-exportacoes-globais-de-carne-bovina-em-2023/,"Wed, 12 Apr 2023 14:49:58 +0000"
‘Vaca louca’ afeta exportações de carne bovina,https://www.beefpoint.com.br/vaca-louca-afeta-exportacoes-de-carne-bovina/,"Wed, 12 Apr 2023 14:48:55 +0000"
Primeira fase do Mapa Conecta Proteína Animal 2023 seleciona 10 startups,https://www.beefpoint.com.br/primeira-fase-do-mapa-conecta-proteina-animal-2023-seleciona-10-startups/,"Wed, 12 Apr 2023 14:41:17 +0000"
